,content,description,feed_url,id,link,published,summary,title
30,"Each week, Tech in Asia Jobs brings you some of the most popular jobs around Asia.
If you’re interested in the startup industry, here are 5 companies that are currently hiring. Get your resumes and job profiles ready, and apply away (:
Hiring? Post a job for free here.
99.co (Singapore)
The 99.co team / Photo credit: 99.co
99.co is a property and real estate portal that uses technology and data science to provide home seekers with a radically honest, transparent and delightful experience.
99.co is on the lookout for new talent to join their diverse team of people. Open positions include a backend engineer and product manager.

Yojee (Singapore)
Yojee is a logistics software that utilizes blockchain, artificial intelligence and machine learning to optimize and manage fleets.
Yojee is looking for a customer success executive in Singapore to handle customer inquiries, a front-end developer to manage their website, as well as a product manager to lead and oversee one or more products.

Voyagin (Singapore)
Voyagin is a travel platform which allows you to book tickets to attractions, tours and activities in Asia. You’ll get to travel as part of your job, and work alongside a multinational team!
If this sounds like something you’re up for, Voyagin is looking for a creative content marketer who can craft engaging travel content, as well as a head of affiliate marketing to help scale their business.

SelfDrvn Enterprise (Malaysia)
The SelfDrvn Enterprise team / Photo credit: SelfDrvn Enterprise
SelfDrvn Enterprise is a B2B workplace engagement SaaS platform that aims to disrupt the way companies approach human resource today.
With plans to grow, SelfDrvn Enterprise is hiring across a variety of positions including marketing, project management, and web development. Be sure to check them out below.

Ralali (Indonesia)
The Ralali team / Photo credit: Ralali
Ralali is an online B2B online marketplace that connects buyers with trusted, reputable suppliers that are selling a variety of products at wholesale prices.
As they grow their footprint in Indonesia, Ralali is seeking a business intelligence analyst, a campaign planner, and a UI/UX Designer amongst many other positions.

This listicle is brought to you by the Tech in Asia Jobs team. Don’t see a job you’re interested in? Search for 4,000+ more jobs here. Hiring? Post a job for free here.

This post 10 fresh tech and startup jobs in Asia this week from companies like Ralali and 99.co appeared first on Tech in Asia.","Handpicked for you this week - new jobs from 99.co, Ralali, Voyagin and more. Check out the latest opportunities in the tech and startup scene now!",https://www.techinasia.com/feed,https://www.techinasia.com/?p=307313,https://www.techinasia.com/tech-startup-job-list-in-asia,"Wed, 28 Mar 2018 04:30:57 +0000","Handpicked for you this week - new jobs from 99.co, Ralali, Voyagin and more. Check out the latest opportunities in the tech and startup scene now!",10 fresh tech and startup jobs in Asia this week from companies like Ralali and 99.co
31,"This article was co-authored by Celine Wong and Yuan Chuan Kee.
Tech in Asia’s mission is to serve the region’s tech and startup community by connecting people through our events, bridging talent gaps via our Jobs platform, and offering insights into this exciting and evolving landscape through news, analysis, and contributions from the community. 
We’ve talked about how we’re going to chart this journey by using our data to synergise our three products through the Concept Graph. Now, we’re excited to share with you our first step towards that goal: our News Feed feature.
Through News Feed, we will provide readers with time-variant content that focuses on what our editors and writers cover, together with curated content from other sources – such as TechCrunch, Reuters and Recode for starters – that cover the tech scene in Asia and beyond, instead of a traditional list that orders the content in a reverse chronological manner. Fundamentally, we want our readers to have a meaningful engagement with our products – we’d like to give you access to content that covers topics that you’re interested in and care about.
Today, we’re excited to release News Feed on our Android and iOS apps. Right now, this is exclusively available on our mobile apps,  but we’ll be rolling it out progressively on our web application in the near future.

Why do we do this?
We are driven by our readers’ needs, so we’re constantly finding ways to serve you better. From readers’ surveys and research, we learned that our readers wanted more content and more depth in our articles. 
Our readers are hungry for more analysis and insights. Drawing from these findings, our team has worked tirelessly to make this happen.
We ran several experiments such as briefs, an article format where we summarized and shared links to great stories from other news sources. We also shared good content from other publishers on our social media channels. The goal was to deliver more quality content to our readers. As we concluded these experiments, we found out that summaries and content from other publishers were well received, and our readers derived value from the additional content.
That led us to think, how can we further scale this and deliver the most value to our users? We eventually came to an epiphany: Tech in Asia could be more than a newsroom – it could be a news distribution platform.
With the help of machines, we can curate and deliver more newsworthy content. That frees up our editorial team to dedicate itself to craft more in-depth content – something that the machines cannot create. This combination powers our News Feed, allowing us to give our readers a holistic view and deeper understanding of Asia’s tech ecosystem.
How do we do this?
Manual curation is inevitable here. However, we have devoted significant product and engineering efforts to make sure that our hardworking editorial team is not alone in this endeavor. We’ve adopted machine learning techniques to process content and establish the relationship and context among the articles using topic modeling – an unsupervised learning algorithm – that’s commonly used for understanding text and deriving higher-level insights. Using humans with domain expertise and an algorithm, we’re able to ensure that our content is relevant to readers.
How does the topic model work in the News Feed?
Topic model is a form of dimensional reduction technique that reduces high dimensional data to lower the number of dimensions with context about each of the derived dimensions. It decreases the words’ frequency in documents to clusters that are defined by the words. In this application, we’re able to derive a specified number of clusters of articles that have contextual relationships. 
With the topic model, it enables us to identify topics such as “Ride-hailing Services” which talks about “Uber”, “Grab”, and “Didi” as well as “Blockchain Technology” which covers “ICOs”, “Bitcoin” and “Cryptocurrencies”. Meanwhile, “Data”, “Machine Learning”, and “Analytics” are some of the elements that fall under “Artificial intelligence”. These topics are used to associate our articles with others, so you’ll see articles that are closely related to each other appear together in the feed.
 
Visualisation on how content from each source is covered by the topic model in planar form
The curated content have their topics derived from the model we developed and we associate them with our own articles based on how similar they are and how closely they are published together. Apps such as Flipboard have used topic models as well to achieve similar objectives.
Moving Forward
First of all, we want to understand how our editors curate content. Although we’re working on aggregating related content for the News Feed, its by-product is data on how editors select content that they think might be interesting and relevant to our readers. 
As content evolves with time, the topic model should evolve as well. We’ve just scratched the surface at this point, and we’re developing capabilities such as visualisation and human-based evaluation techniques to assist us in building models that can help teams grasp what’s happening around the world and use it as a catalyst to drive content strategy.
We’re also planning to develop a personalized feed based on your interests and reading habits. This will allow you to navigate through the streams of content easily and improve your content discovery experience.
We hope that you will find this feature useful, and we look forward to hearing your feedback as we work towards building a better product for you.
Download the app and try out our News Feed today!
 
This post Reimagining Tech in Asia’s News Feed appeared first on Tech in Asia.",Going beyond the newsroom and transforming into a news distribution platform.,https://www.techinasia.com/feed,https://www.techinasia.com/?p=489218,https://www.techinasia.com/reimagining-tech-asias-news-feed,"Wed, 28 Mar 2018 03:03:15 +0000",Going beyond the newsroom and transforming into a news distribution platform.,Reimagining Tech in Asia’s News Feed
32,"
With the rise in mobile connectivity, it comes as no surprise how ecommerce has steadily grown to run the online consumer show, providing convenience, reach and efficiency to businesses and consumers alike.
This year, Tech in Asia Singapore 2018 takes a close look at five exhibiting ecommerce startups changing the consumer space through their products and services. Here’s a brief snippet of how these startups are taking on the growing goliath that is ecommerce.
Grouke

When it comes to making a purchase in a connected society, people have grown to rely less on their decision-making skills and instead focus on crowdsourcing their experiences and thoughts  with others to come up with a decision. This is why Grouke is aiming to redesign the digital consumer experience through the power of social influencing.
Equipped with their own set algorithm called “Flypers” and their user’s video reviews, Grouke’s ecommerce platform tweaks consumer experiences through their social networks’ shared reviews and preferences.
Awesell

In a highly competitive niche market such as dropshipping, it becomes quite tedious to manage scaling operations, especially when the diversification of products, and the communication between the suppliers all come into play at once.
Cue in Awesell, an ecommerce and workflow management app for dropshipping businesses. Their platform was created to help dropshipping businesses centralize managing and recording their products, customers, and shipment orders all in one convenient app. With their affordable pricing options and streamlined user interface, small to big businesses can benefit from Awesell’s shipment tracking, inventory management, and intuitive chat system in today’s fast-paced commerce environment.
Deal’n

With ecommerce, it’s easy to categorize consumers according to their preferences, interests, and historical purchases. But it’s quite often that we overlook those who have less to consume products. Deal’n bridges that gap between the traditional consumer market and the vulnerable members of our society, championing community over individualistic goals for profit.
With a platform that highlights the trading and sharing of useful skills, upcycled products and recycled products, Deal’n enables others to offer what would normally be difficult to sell or share, to something marketable for others to purchase, collaborate and benefit from.
Brambang

Although any kind of product could be sold online, fresh and local produce have yet to really catch on with their other conventional product counterparts. To help break that barrier, Brambang created their ecommerce platform to put the spotlight on locally gathered food.
What started as a platform to sell only one kind of fresh produce, Brambang has now expanded to multiple variations of meticulously sourced and selected vegetables, fruits, and even spices. Created with the sole goal of increasing the appeal and sales of indonesian agricultural products, the startup wants to support both buyers, suppliers, and sellers through the provision of an efficient and streamlined platform for affordable produce commerce.
Nidwork

Thinking of getting something done for an office space, or maybe for a house? With plenty of searching to do and calls to make to find the right designer, contractor, architect or even supplier, Nidwork aims to simplify the process of getting the right people for the job. Primarily serving the business-to-business market, Nidwork connects people within the construction and design industry with each other, multiple projects and various services in their platform.
Flex your startup’s products to over 5,000 potential customers at TIA Singapore 2018!
Aspiring to change the landscape of ecommerce like these five startups? If you’re one of them and looking to enhance your exposure, increase your funding, or network within and outside of the industry, then here’s your opportunity to showcase your startup at Tech in Asia Singapore 2018.
All you’ll need is a working prototype and a funding of less than US$3 million and you’re set to apply for your exhibitor’s booth at one of Asia’s largest tech conference. If you apply before April 8, you’ll get to shave 15 percent off (US$89) your booth package!

If you’re not ready to go live on the conference floors, fret not, you can still partake in the amazing events and meet startups like the ones mentioned above as an attendee. Even better, purchase your tickets before April 8, and you’ll get to lock in a 15 percent discount. Just use the code “tiasg15” and you’re all set!

This post 5 aspiring ecommerce startups exhibiting at TIA Singapore 2018 appeared first on Tech in Asia.",Here’s a sneak peek at 5 ecommerce startups showcasing their exciting products and services at TIA Singapore 2018.,https://www.techinasia.com/feed,https://www.techinasia.com/?p=488607,https://www.techinasia.com/5-aspiring-ecommerce-startups-exhibiting-tia-singapore-2018,"Wed, 28 Mar 2018 03:00:02 +0000",Here’s a sneak peek at 5 ecommerce startups showcasing their exciting products and services at TIA Singapore 2018.,5 aspiring ecommerce startups exhibiting at TIA Singapore 2018
33,"Over 1 billion of the world’s 1.7 billion Muslims live in Asia, with around 250 million in Southeast Asia alone – and two thirds of them are under 30. Asia’s Muslims share some common bonds and values that companies can tap into. From Islamic finance to specialist travel services, we explore a bunch of up-and-coming startups catering to these phone-addicted millennials.

This post Startups rush to cater to young Muslims appeared first on Tech in Asia.","Over 1 billion of the world’s 1.7 billion Muslims live in Asia, with around 250 million in Southeast Asia alone - and two thirds of them are under 30.",https://www.techinasia.com/feed,https://www.techinasia.com/?p=488627,https://www.techinasia.com/muslim-startups-chase-millennials,"Wed, 28 Mar 2018 01:30:35 +0000","Over 1 billion of the world’s 1.7 billion Muslims live in Asia, with around 250 million in Southeast Asia alone - and two thirds of them are under 30.",Startups rush to cater to young Muslims
34,"The CardUp team / Photo credit: CardUp
Do you ever wish you could use your credit card to pay for things like rent, taxes, or your employees’ salaries? CardUp founder and CEO Nicki Ramsay certainly did, and the Singapore-based fintech startup is the result of that wishful thinking. And it has managed to snag a seed round worth US$1.7 million by enabling users and businesses to do just that.
The round was led by Sequoia India and early-stage VC fund Seedplus. Barring an initial angel investment, this is the first time that CardUp has raised funding from institutional investors.
CardUp has created a website where users can set up recurring payments through their credit cards to pay rent, taxes, season parking, insurance, car loans, and more, that are usually made through bank transfers or checks. Transactions made through the platform this way go to recipients via bank transfer so that landlords, insurance firms, and the tax service don’t need to be enrolled on it themselves to get paid.
Businesses can use the platform to pay taxes, payroll, or suppliers in the same way. CardUp allows them to use their credit cards as a financing tool so that they have access to cash immediately, without having to apply for costly and time-consuming loans. They can then repay that credit simply by paying off their credit card bill.
Consumers and enterprise users have the additional incentive of earning rewards like rebates and air miles that traditionally come with credit card usage, but were not previously available to them for this kind of payments. The platform accepts “all major credit cards” in Singapore at the moment, and it has partnered with several banks and operators like Visa and Mastercard.
Small-business woes
Ramsay started CardUp in 2016, after spending most of her career in various roles at credit card operator American Express. During her stint, one of her goals was to spur more credit card usage, but one obstacle to growth she discovered was how some types of payments can’t really be made via cards. She herself was frustrated she couldn’t use them to pay off large expenses like rent.
Ramsay always had an entrepreneurial streak, and CardUp was one of several business ideas she had explored in the past. “They all got binned so they’re not worth talking about,” she jokes.
But the idea for CardUp was different. Through her corporate position, she had made the right connections and acquired the necessary expertise to give her the confidence to quit and start up. CardUp was part of Finlab’s inaugural fintech cohort in Singapore and cultivated early relationships with Mastercard as well as banks like United Overseas Bank and Citibank.
CardUp allows SMEs to use their credit cards as a financing tool so that they have access to cash without having to apply for costly and time-consuming loans.
The funding will help CardUp to further improve its business offering, which is aimed at small and medium-sized enterprises (SMEs). Such companies often face problems with cash flow because of delayed payments from their customers. A survey by entrepreneurship agency SPRING Singapore found that three in five SMEs in the city-state have to deal with such delays, which affect their working capital.
CardUp wants to enable those businesses to secure a line of credit by using their credit cards on the platform to ensure cash flow. “We offer short-term financing solutions, which I think have been missing from the market,” Ramsay says. By just paying off their credit card bill, businesses have an easier time getting credit than seeking loans from financial institutions.
The website also offers invoicing tools and features such as automated recurring payments. Ramsay hopes that in this way, CardUp can be part of the initiative to digitize Singapore’s small businesses, which is spearheaded by Singapore’s Info-communications Media Development Authority.
CardUp is also looking to staff up. Recent key hires include Sandra Ernst, who was CEO of peer-to-peer invoice financing startup SmartFunding. Ernst left SmartFunding last summer, and joined CardUp as head of operations in late 2017.
CardUp is split between Singapore and India, where its tech team is based. That’s headed by Anand Nirgudkar, a software engineering veteran of 18 years. Nirgudkar was part of financial services tech firm Synechron and co-founded software solutions startup Ikigai Technology in India. Given the struggles that most startups face in finding technical talent in Singapore, the startup chose to build the tech team in Pune.
CardUp founder and CEO Nicki Ramsay speaks during a panel at Fintech Festival, organized by the Monetary Authority of Singapore / Photo credit: CardUp
Splitting the bill
There’s one more startup in Singapore that helps businesses make payments with credit cards: iPaymy. It recently raised its own seed round worth US$1 million, from Beenext and DG Incubation. Ramsay says that CardUp differentiates itself by being available to consumers as well. iPaymy started out as a consumer product but pivoted to business customers based on user feedback, according to its founders.
CardUp’s consumer base has helped the company grow organically, through both user referrals and word of mouth online. The website been recommended by finance bloggers, while online forum users share tips like how to maximize rewards from CardUp’s platform. “That viral effect has been great to see, and it’s testament to the demand in the market,” says Ramsay. “It shows us we’re on the right track but also gives us insights as to what we should be building.”
CardUp’s automated payment tools are another differentiator. “We frequently hear this feedback from users, who can manage, edit, cancel or amend payments at any time from their dashboard,” Ramsay says, adding that this activity makes up 70 percent of all payments on the platform.
CardUp’s consumer base has helped the company grow organically, through both user referrals and word of mouth online.
Another potential issue with targeting the SME financing segment is a company with a bright green logo. Grab recently announced a lending and insurance program for small businesses, powered by its GrabPay digital wallet. While the service targets different clients than those of CardUp and iPaymy, it could eventually be a threat to them by virtue of sheer user base size.
Ramsay feels that customer segments are different enough between the companies for this to not be a concern. CardUp’s users already have access to credit cards and bank accounts and are more interested in the recurring payments offering for their rent, tuition fees, taxes, and so on. Grab’s product, as it stands now, focuses on underbanked users in Southeast Asia. Plus, CardUp’s service only requires the payer to be signed up for the platform to be useful.
Ramsay didn’t share specific details about CardUp’s revenue and active users. But she says the latter number is in the “thousands” and that the growth rate of users (consumer and business combined) has been 41 percent month-on-month since the startup launched.
In the past year, the startup says that over US$42 million in payments have been made through the platform, which accounted for a 1 percent growth in credit card spending in Singapore from 2016 to 2017.
Converted from Singapore dollars. US$1 = S$1.31
This post Fintech startup rings up $1.7m funding from Sequoia and Seedplus to help digitize SMEs appeared first on Tech in Asia.","Singapore-based CardUp lets you use your credit card to pay rent, taxes, salaries, and more. With fresh funding, it plans to double down on the financing needs of small businesses.",https://www.techinasia.com/feed,https://www.techinasia.com/?p=489436,https://www.techinasia.com/cardup-seed-funding-profile,"Wed, 28 Mar 2018 00:15:54 +0000","Singapore-based CardUp lets you use your credit card to pay rent, taxes, salaries, and more. With fresh funding, it plans to double down on the financing needs of small businesses.",Fintech startup rings up $1.7m funding from Sequoia and Seedplus to help digitize SMEs
