,content,description,feed_url,id,link,published,summary,title
0,"Cloudflare  decided to use April Fool’s Day (4/1) to share some news about four 1’s that could help speed your internet browsing. The company announced today that it’s launching a DNS service for consumers called 1.1.1.1
The company’s tool — which is not some super nerdy April Fool’s joke — will allow users to shorten load times of web pages and keep some data away from network providers. Cloudfare boasts it will be “the Internet’s fastest, privacy-first consumer DNS service.”
In layman’s terms, by punching the number 1 four times into their DNS network info, consumers can hand over the reigns over to Cloudflare to connect a URL that they type into the tool bar — say, techcrunch.com — with that site’s IP address, a process that’s done by making requests to the Domain Name System (DNS). If you go to 1.1.1.1, you’ll get some info on how to enable this on the device that you’re on.
It’s completely separate from the startup’s authoritative DNS service for its customers but it does take advantage of Cloudflare’s existing network to provide the fastest speeds possible to users, shaving off milliseconds from other service like Google’s Public DNS Service.
It’s important to note that this DNS service isn’t some magical catch-all, you’re still much better off operating a VPN if you don’t want any of your web activity being exposed. One of the main use cases that the company seems to be tackling here is how governments have used DNS to get network providers to censor citizens access to the web.
“[I]t’s been depressing to us to watch all too frequently how DNS can be used as a tool of censorship against many of the groups we protect. While we’re good at stopping cyber attacks, if a consumer’s DNS gets blocked there’s been nothing we could do to help,” Prince said in blog post.
The company says that the new service will help keep some data out of ISPs’ hands and that they won’t keep data in their hands for long either. Cloudflare has pledged to both never write users’ IP addresses to disk and that they’ll purge all logs from their system after 24 hours. CEO Matthew Prince doesn’t want you taking their word for it though, he detailed in a blog that the company has paid for an independent audit firm to take a look at their code annually and ensure that they’ve been doing this.
Cloudflare has always seemed to prioritize securing a healthy future for the internet, that’s led it into some tough predicaments with like Nazis and stuff, with this latest launch it seems that the company is trying to enact some positive changes for promoting privacy and speed on the consumer side.",Cloudflare decided to use April Fool&#8217;s Day (4/1) to share some news about four 1&#8217;s that could help speed your internet browsing. The company announced today that it&#8217;s launching a DNS service for consumers called 1.1.1.1 The company&#8217;s tool &#8212; which is not some super nerdy April Fool&#8217;s joke &#8212; will allow users to shorten [&#8230;],http://techcrunch.com/feed/,https://techcrunch.com/?p=1615371,https://techcrunch.com/2018/04/01/cloudflares-new-privacy-focused-dns-service-speeds-up-your-web-browsing/,"Sun, 01 Apr 2018 20:21:54 +0000",Cloudflare decided to use April Fool&#8217;s Day (4/1) to share some news about four 1&#8217;s that could help speed your internet browsing. The company announced today that it&#8217;s launching a DNS service for consumers called 1.1.1.1 The company&#8217;s tool &#8212; which is not some super nerdy April Fool&#8217;s joke &#8212; will allow users to shorten [&#8230;],Cloudflare’s new ‘privacy-focused’ DNS service speeds up your web browsing
1,"


Steven Aquino
Contributor




Share on Twitter
 




		Steven Aquino is a freelance tech writer and iOS accessibility expert.	

More posts by this contributor

At this month’s WWDC, Apple unveiled refined accessibility tools
The pleasure and the pain of the accessible smart home



From an accessibility news standpoint, this week’s Apple event in Chicago was antithetical to the October 2016 event. At the latter event, Apple  began the presentation with a bang — showing the actual video being edited using Switch Control in Final Cut. Tim Cook came out afterwards to talk some about Apple’s commitment to serving the disabled community before unveiling the then-new accessibility page on the company’s website.

By contrast, the education-themed event in Chicago  this week went by with barely a mention of accessibility. The only specific call-out came during Greg Joswiak’s time on stage talking about iPad, when he said “accessibility features make iPad a learning tool for everyone.”
That doesn’t mean, however, accessibility has no relevance to what was announced.
I was in the audience at Lane Tech College Prep on Tuesday covering the event. As a former special educator –and special education student — I watched with keen interest as Apple told their story around education. While Apple is targeting the mainstream, I came away with strong impressions on how Apple can make serious inroads in furthering special education as well.
It’s Called ‘Special’ for a Reason
Apple is obviously—rightfully—building their educational strategy towards mainstream students in mainstream classes. It’s a classic top-down approach: Teachers assign students work via handouts, for such activities as writing essays or completing science projects. This is the entire reason for Apple’s Classroom and Schoolwork apps. However well-designed, they lack an element.
Where they lack is there is nothing afforded, at least in specific terms, to teachers and students in special education settings. Apple’s strategy here is defined, again, by the classic teacher-student relationship, without any regard for other models. I’m not levying a criticism on the company; this is the reality.
At many levels, special education classrooms do not function in a way that’s conducive to Apple’s vision for learning at this time. In the moderate-to-severe early childhood (Pre-K) classrooms I worked in for close to a decade, the structure was such that most, if not all, activities were augmented by a heavy dose of adult support. Furthermore, most of our students were pulled out of class at certain times for additional services such as speech services and physical/occupational therapy sessions.
In short, there were no lectures or essay prompts anywhere.
This is where accessibility comes in. There is enormous potential for Apple to dig deeper and expand the toolset they offer to educators and students. To accommodate for special education is, in my view, akin to accommodating disabled users by offering accessibility features on each of Apple’s software platforms.
Special education is special for a reason. It involves ways of teaching and learning that are unique, and the people who work and learn in these environments deserve the same consideration.
Accessibility is Apple’s Secret Weapon
Leading up to the event, there was much talk in the Apple community of writers and podcasters that Google  is eating Apple’s lunch in the schools market because Chromebooks are dirt cheap for districts and most everyone relies on Google Docs.
I’m not interested in the particulars of this argument. What I am interested in, however, is simply pointing out that despite the perception Apple products are too expensive and less capable, they are better in one meaningful sense: accessibility.
Consider Chromebook versus iPad. In many levels of special education, an iPad is far superior to a Chromebook. The tablet’s multi-touch user interface is far more intuitive, and more importantly, iOS is built with accessibility in mind. From VoiceOver to Dynamic Type to Switch Control and more, an iPad (or an iPod Touch, for that matter) can provide a far more accessible and enriching learning experience for many students with disabilities than a Chromebook. And lest we forget the App Store effect; there are many outstanding apps geared for special ed.
This is a crucial point that many technology pundits who lament Apple’s position in the education market always seem to miss.
Making Special Educators More Special
One area where Apple can greatly improve the lives of teachers is by broadening the Schoolwork app such that it makes IEP prep easier and, playing to Apple’s core strength, more modern. Historically, even today, IEPs are planned and written using stacks of paperwork. Goals, assessments, and consent forms are handwritten (sometimes typed) and stapled together. And being a binding legal document, teachers must ensure there are the proper signatures on every page, or else be dinged for being out of compliance with protocols. In sum: the IEP is the bane of every special educator’s existence because they take so much time.
To this end, Apple could do special education teachers a grand service by adding a module of sorts to its Schoolwork app that would allow them to more easily create and track a student’s IEP. There could be charts for tracking goal progress, as well as ways to collate and distribute documents amongst the IEP team (SLPs, OT/PT, etc) and of course parents. Teachers could even send an email to parents with any consent forms attached and encourage them to sign with Apple Pencil on their iPad, if they have one.
At the very least, it would make IEP prep infinitely more efficient, and perhaps alleviate some of the stress at the actual meetings. Digitizing the process would be game-changing, I think.
Bottom Line
The ideas I’ve outlined here are well within Apple’s wheelhouse. They would likely need to collaborate with special educators and districts on things like IEP forms and policies, but it is certainly within them to do so. They can do this if they want.
To reiterate an earlier point, special education deserves just as much thoughtful consideration and innovation as the education industry at large. Given Apple’s unwavering support of accessibility, this is an area in which they can surely improve.","Steven Aquino Contributor Share on Twitter Steven Aquino is a freelance tech writer and iOS accessibility expert. More posts by this contributor At this month&#8217;s WWDC, Apple unveiled refined accessibility tools The pleasure and the pain of the accessible smart home From an accessibility news standpoint, this week’s Apple event in Chicago was antithetical to the [&#8230;]",http://techcrunch.com/feed/,https://techcrunch.com/?p=1615366,https://techcrunch.com/2018/04/01/what-apples-education-announcements-mean-for-accessibility/,"Sun, 01 Apr 2018 19:30:20 +0000","Steven Aquino Contributor Share on Twitter Steven Aquino is a freelance tech writer and iOS accessibility expert. More posts by this contributor At this month&#8217;s WWDC, Apple unveiled refined accessibility tools The pleasure and the pain of the accessible smart home From an accessibility news standpoint, this week’s Apple event in Chicago was antithetical to the [&#8230;]",What Apple’s education announcements mean for accessibility
2,"What goes up must come down. That’s generally the rule, anyway, certainly for spacecraft that have fulfilled their purpose and have no way to stay in orbit. Such is the case of Tiangong-1, China’s first space station, which after nearly 7 years in space is making an uncontrolled descent and should provide a nice fiery light show in the skies over… somewhere.
Because there are so many unknowns about Tiangong-1’s trajectory, observers can only give an educated guess. The only thing they’re pretty sure about is that it’s going to drop some time in the next 24 hours — probably sometime tonight, and somewhere between 43 degrees north and 43 degrees south.
But owing to the speeds involved and the inherently unpredictable nature of how a large body will tumble through the atmosphere, the exact time and location won’t be known basically until the event occurs. “At no time will a precise time/location prediction from ESA be possible,” explained reentry experts at the European Space Agency.
That sounds quite dire, but it isn’t.

Sure, Tiangong-1 is about the size of a schoolbus and weighs 9.4 tons, but unlike a meteorite of that size the station is hollow and fragile, and should break apart completely during its descent. There’s no danger, experts insist. No one is on board the station and it isn’t on a collision course with any crewed craft.
It may seem a little crazy, but burning up in the atmosphere is just a part of the natural life cycle of large spacecraft. This one isn’t even that big.
Tiangong-1 (the name roughly translates to “Heavenly Palace”) was launched in late 2011 in two parts, which connected in space — the first such feat accomplished by China’s space program. Over the next two years, three spacecraft docked with the newly formed station: one robotic craft, Shenzhou-8, and two crewed missions, Shenzhou-9 and 10, each with three on board.
These missions proved the viability of China’s space station tech (another test platform, Tiangong-2, was launched in 2016), and in 2013 Tiangong-1, having accomplished what its creators set out to do, was deactivated. Its creators planned to have it execute a controlled descent at some point, using its thrusters to put it on a path to break up over the ocean.
As little risk as there may be of debris hitting someone, it’s good practice not to take that risk if you don’t have to, and good manners not to dispose of your space junk over someone else’s country.
A helpful visualization of the expected debris footprint of Tiangong-1 from The Aerospace Corporation.
Unfortunately, the spacecraft stopped responding to its handlers in China about two years ago, meaning that a controlled descent was no longer possible. As a result, Tiangong-1’s orbit has decayed naturally and it’s only in the last few months that it’s become clear when it would come down.
Because we have no telemetry from the station, we only know what we can observe from outside the station (like Fraunhofer’s radar imagery, shown above), and a host of variables make it difficult to say anything with certainty. It wasn’t until this week that its deorbit path has become clear enough that space authorities are confident giving even a 24-hour window when it will come down.
Those on the ground there may possibly be treated to a “splendid” light show, as China’s space agency put it, as if a large meteor is breaking up in the upper atmosphere. It should be visible for a minute or so as the station tumbles and breaks up and its constituent pieces burn.
Predictions may get slightly better depending on observations, so I’ll update this post if the window is significantly altered.","What goes up must come down. That's generally the rule, anyway, certainly for spacecraft that have fulfilled their purpose and have no way to stay in orbit. Such is the case of Tiangong-1, China's first space station, which after nearly 7 years in space is making an uncontrolled descent and should provide a nice fiery light show in the skies over... somewhere.",http://techcrunch.com/feed/,https://techcrunch.com/?p=1612324,https://techcrunch.com/2018/04/01/chinas-9-ton-tiangong-1-space-station-will-burn-up-tonight-but-no-one-knows-quite-where/,"Sun, 01 Apr 2018 17:39:10 +0000","What goes up must come down. That's generally the rule, anyway, certainly for spacecraft that have fulfilled their purpose and have no way to stay in orbit. Such is the case of Tiangong-1, China's first space station, which after nearly 7 years in space is making an uncontrolled descent and should provide a nice fiery light show in the skies over... somewhere.","China’s 9-ton Tiangong-1 space station will burn up tonight, but no one knows quite where"
3,"Providing ongoing mentorship can be impractical for busy professionals. With STEAMRole, the idea is to empower professionals to easily share their stories with students and young professionals.
It’s like Tinder for finding your role model and dream career in science, technology, engineering, art or math, STEAMRole founder and CEO Clarence Wooten told me.
“As the saying goes, you can’t be what you can’t see,” Wooten said.
Similar to Snapchat’s story functionality, students and aspiring professionals can consume inspirational content from role models. For role models, they can post about how their backgrounds, the work they do and how they landed their dream job.
[gallery ids=""1614865,1614864,1614863,1614862,1614861,1614860""]
“We want to make it easy for role models to give back and who want to mentor,” Wooten said. “We do it in a way that’s like creating a Snapchat story, and then followers can subscribe to content.”
STEAMRole is also incorporating blockchain technology to incentivize learners to achieve certain skills through its digital currency, RoleCoin. STEAMRole currently has several hundred role models signed up to be notified when it launches.
","Providing ongoing mentorship can be impractical for busy professionals. With STEAMRole, the idea is to empower professionals to easily share their stories with students and young professionals. It&#8217;s like Tinder for finding your role model and dream career in science, technology, engineering, art or math, STEAMRole founder and CEO Clarence Wooten told me. &#8220;As the [&#8230;]",http://techcrunch.com/feed/,https://techcrunch.com/?p=1614838,https://techcrunch.com/2018/04/01/steamrole-is-like-tinder-for-mentorship/,"Sun, 01 Apr 2018 17:38:23 +0000","Providing ongoing mentorship can be impractical for busy professionals. With STEAMRole, the idea is to empower professionals to easily share their stories with students and young professionals. It&#8217;s like Tinder for finding your role model and dream career in science, technology, engineering, art or math, STEAMRole founder and CEO Clarence Wooten told me. &#8220;As the [&#8230;]",STEAMRole is like Tinder for mentorship
4,"The Defense Department’s research wing is serious about putting drones into action, not just one by one but in coordinated swarms. The Offensive Swarm-Enabled Tactics program is kicking off its second “sprint,” a period of solicitation and rapid prototyping of systems based around a central theme. This spring sprint is all about “autonomy.”
The idea is to collect lots of ideas on how new technology, be it sensors, software, or better propeller blades, can enhance the ability of drones to coordinate and operate as a collective.
Specifically, swarms of 50 will need to “isolate an urban objective” within half an hour or so by working together with each other and ground-based robot. That at least is the “operational backdrop” that should guide prospective entrants in their decision whether their tech is applicable.
So a swarm of drones that seed a field faster than a tractor, while practical for farmers, isn’t really something the Pentagon is interested in here. On the other hand, if you can sell that idea as a swarm of drones dropping autonomous sensors on an urban battlefield, they might take a shine to it.
But you could also simply demonstrate how using a compact ground-based lidar system could improve swarm coordination at low cost and without using visible light. Or maybe you’ve designed a midair charging system that lets a swarm perk up flagging units without human intervention.
Those are pretty good ideas, actually — maybe I’ll run them by the program manager, Timothy Chung, when he’s on stage at our Robotics event in Berkeley this May. Chung also oversees the Subterranean Challenge and plenty more at DARPA . He looks like he’s having a good time in the video explaining the ground rules of this new sprint:

You don’t have to actually have 50 drones to take part — there are simulators and other ways of demonstrating value. More information on the program and how to submit your work for consideration can be found at the FBO page.","The Defense Department's research wing is serious about putting drones into action, not just one by one but in coordinated swarms. The Offensive Swarm-Enabled Tactics program is kicking off its second ""sprint,"" a period of solicitation and rapid prototyping of systems based around a central theme. This spring sprint is all about ""autonomy.""",http://techcrunch.com/feed/,https://techcrunch.com/?p=1615203,https://techcrunch.com/2018/04/01/darpa-wants-new-ideas-for-autonomous-drone-swarms/,"Sun, 01 Apr 2018 17:18:50 +0000","The Defense Department's research wing is serious about putting drones into action, not just one by one but in coordinated swarms. The Offensive Swarm-Enabled Tactics program is kicking off its second ""sprint,"" a period of solicitation and rapid prototyping of systems based around a central theme. This spring sprint is all about ""autonomy.""",DARPA wants new ideas for autonomous drone swarms
